BlogImageURL,BlogTitle,BlogDate,BlogLikesCount
https://rategaincom.wpenginepowered.com/wp-content/uploads/2023/10/Google-AdSenses-New-Related-Search-Feature-in-Auto-Ads.png,"Maximize Your Hotel’s Exposure with Google AdSense’s New ""Related Search"" Feature in Auto Ads","OCTOBER 20, 2023",7
https://rategaincom.wpenginepowered.com/wp-content/uploads/2023/10/Transforming-with-Facebooks-Reservation-BUYING-Strategy.png,Beyond Reach & Frequency: Hotels' New Era with Facebook's 'Reservation' Buying Type,"OCTOBER 12, 2023",3
https://rategaincom.wpenginepowered.com/wp-content/uploads/2023/10/Overbookings-Cancellations-Not-a-Problem-with-Modern-Hotel-Booking-Engines.png,Managing Overbookings and Cancellations with Hotel Booking Engines,"OCTOBER 5, 2023",2
https://rategaincom.wpenginepowered.com/wp-content/uploads/2023/10/Hotel-Distribution-Done-Right-Choosing-between-GDS-and-Channel-Manager.png,Global Distribution System (GDS) vs. Channel Manager: Which is Right for Your Hotel,"OCTOBER 1, 2023",2
https://rategaincom.wpenginepowered.com/wp-content/uploads/2023/09/Bing-Hotel-Ads-Your-Hotels-Secret-Revenue-Booster.png,Why Bing Hotel Ads Should Be in Your Marketing Mix,"SEPTEMBER 28, 2023",1
https://rategaincom.wpenginepowered.com/wp-content/uploads/2023/09/Unlocking-Top-Travel-Destinations-in-Egypt-A-Hoteliers-Playbook.jpg,Unlocking Top Travel Destinations in Egypt: A Hotelier's Playbook,"SEPTEMBER 25, 2023",0
https://rategaincom.wpenginepowered.com/wp-content/uploads/2023/09/Shaping-Success-in-Egypts-Dynamic-Hospitality-Landscape.jpg,Shaping Success in Egypt's Dynamic Hospitality Landscape: A Roadmap for Hoteliers,"SEPTEMBER 22, 2023",0
https://rategaincom.wpenginepowered.com/wp-content/uploads/2023/09/Powering-Hospitality-How-Renewable-Energy-Is-Reshaping-Hotels.png,Checking In to a Greener Future: Renewable Energy in Hotels,"SEPTEMBER 15, 2023",0
https://rategaincom.wpenginepowered.com/wp-content/uploads/2023/09/How-Travel-Sellers-Support-Local-Economies.png,Sustaining Communities: The Role of Travel Sellers in Sustainable Tourism,"SEPTEMBER 14, 2023",0
https://rategaincom.wpenginepowered.com/wp-content/uploads/2023/09/Drip-by-Drip-How-Hotels-Are-Leading-the-Way-in-Water-Conservation.png,Flowing Towards Sustainability: Water Conservation in Hotels,"SEPTEMBER 11, 2023",1
https://rategaincom.wpenginepowered.com/wp-content/uploads/2023/09/Eco-friendly-practices-in-Vacation-Rentals.png,Eco-Friendly Practices in Vacation Rentals: A Win-Win for Guests and the Environment,"SEPTEMBER 10, 2023",0
https://rategaincom.wpenginepowered.com/wp-content/uploads/2023/09/Trash-to-Treasures-Zero-Waste-Travelers-Handbook.png,Zero-Waste Travel: A Sustainable Path to Explore the World,"SEPTEMBER 9, 2023",0
https://rategaincom.wpenginepowered.com/wp-content/uploads/2023/09/Hotel-Sustainable-Supply-Chain-Strategies.png,Building a Greener Future: Sustainable Supply Chain Management in Hotels,"SEPTEMBER 8, 2023",0
https://rategaincom.wpenginepowered.com/wp-content/uploads/2023/09/Airlines-Sustainable-Innovations.png,Airline Sustainability Initiatives: How Airlines are Going Green,"SEPTEMBER 7, 2023",0
https://rategaincom.wpenginepowered.com/wp-content/uploads/2023/09/Embrace-Eco-Tourism-Your-Passport-to-Sustainable-Wanderlust.png,Exploring Eco-Tourism: Where Nature Meets Responsible Travel,"SEPTEMBER 6, 2023",0
https://rategaincom.wpenginepowered.com/wp-content/uploads/2023/09/Measuring-and-Reporting-Sustainability-Impact.png,Measuring and Reporting Sustainability Impact: Metrics for Hotels and Travel Sellers,"SEPTEMBER 6, 2023",0
https://rategaincom.wpenginepowered.com/wp-content/uploads/2023/09/Sustainable-Practices-for-Tour-Operators.png,Reducing Carbon Footprint: Sustainable Practices for Tour Operators,"SEPTEMBER 5, 2023",1
https://rategaincom.wpenginepowered.com/wp-content/uploads/2023/09/Wings-and-Wonders-Biodiversity-Conservation-in-Tourism.png,Preserving Paradise: Biodiversity Conservation in Travel,"SEPTEMBER 4, 2023",0
https://rategaincom.wpenginepowered.com/wp-content/uploads/2023/09/Green-Hotel-Badge-for-Sustainable-Accommodations.png,"How Green is your Hotel? Do Good and Show it to the World – on Google, for Example","SEPTEMBER 3, 2023",1
https://rategaincom.wpenginepowered.com/wp-content/uploads/2023/09/Evolution-of-UK-Hospitality.png,The Digital Evolution of UK Hospitality: A Historic Journey From Keys to Clicks,"SEPTEMBER 1, 2023",1
https://rategaincom.wpenginepowered.com/wp-content/uploads/2023/10/Driving-Green-The-Future-of-Sustainable-Car-Rentals.png,Driving Green: The Future of Sustainable Car Rentals,"SEPTEMBER 1, 2023",0
https://rategaincom.wpenginepowered.com/wp-content/uploads/2023/09/Taste-the-Future-Sustainable-Food-Practices-in-Hospitality.png,Taste the Future: Sustainable Food Practices in Hotels and Restaurants,"SEPTEMBER 1, 2023",0
https://rategaincom.wpenginepowered.com/wp-content/uploads/2023/10/The-DMO-Effect-Enhancing-Tourisms-Role-in-Local-Economies.png,The Heart of Travel: DMOs and Their Impact on Local Economies,"SEPTEMBER 1, 2023",0
https://rategaincom.wpenginepowered.com/wp-content/uploads/2023/08/Your-Hotels-Social-Media-Just-Got-Google-fied-Google-Business-Profile.webp,Social Media Meets Google Business Profile: Here's Why You Should Care,"AUGUST 21, 2023",1
https://rategaincom.wpenginepowered.com/wp-content/uploads/2023/08/The-Hidden-Costs-of-Poor-Hotel-System-Connectivity.png,Connect the Dots: Decoding Common Hotel System Connectivity Challenges,"AUGUST 18, 2023",1
https://rategaincom.wpenginepowered.com/wp-content/uploads/2023/08/Google-Analytics-4-Rolls-Out-New-User-Data-Export-To-BigQuery.webp,GA4's New User Data Export to BigQuery: Your Key to Hyper-Personalized Hotel Marketing,"AUGUST 17, 2023",1
https://rategaincom.wpenginepowered.com/wp-content/uploads/2023/08/Role-of-AI-Ml-in-Hotel-Search-Engines.webp,How AI and Machine Learning are Shaping Hotel Search Engines,"AUGUST 16, 2023",1
https://rategaincom.wpenginepowered.com/wp-content/uploads/2023/08/DE-I-RG.webp,Unpacking Global DE&I Pillars: A Strategy for Inclusivity,"AUGUST 16, 2023",1
https://rategaincom.wpenginepowered.com/wp-content/uploads/2023/08/evolution-of-hotel-search-engines.webp,"The Evolution of Hotel Search Engines: Past, Present, and Future","AUGUST 15, 2023",1
https://rategaincom.wpenginepowered.com/wp-content/uploads/2023/08/India-beyond-75.webp,From Green Revolution to Space Exploration: 75 Innovations Propelling India Beyond 75,"AUGUST 14, 2023",1
https://rategaincom.wpenginepowered.com/wp-content/uploads/2023/08/How-Hotel-Search-Engines-are-Supporting-Sustainable-Travel.webp,Going Green: How Hotel Search Engines are Championing the Cause of Sustainable Travel,"AUGUST 10, 2023",1
https://rategaincom.wpenginepowered.com/wp-content/uploads/2023/08/Google_s-New-Hotel-Search-Carousel.webp,Get Noticed: The Smart Hotelier's Guide to Google's Filtered Search Carousel,"AUGUST 9, 2023",1
https://rategaincom.wpenginepowered.com/wp-content/uploads/2023/08/Understanding-the-Mechanics-of-Hotel-Search-Engines.webp,Understanding the Mechanics of Hotel Search Engines,"AUGUST 9, 2023",1
https://rategaincom.wpenginepowered.com/wp-content/uploads/2023/08/Hospitality-in-the-Digital-Age-Softwares-for-Hotel-Success.webp,Hospitality in the Digital Age: Software Breakthroughs and What's Next,"AUGUST 8, 2023",1
https://rategaincom.wpenginepowered.com/wp-content/uploads/2023/08/The-Heart-of-Hospitality-A-Guide-to-Outshine-Competitors-at-Every-Traveler-Touchpoint.webp,Gaining a Competitive Edge at Every Stage of the Traveler Journey,"AUGUST 4, 2023",1
https://rategaincom.wpenginepowered.com/wp-content/uploads/2023/08/Fine-Tuning-Your-Hotels-Strategy-The-Art-of-Revenue-Management-Analytics.webp,Elevate Your Hotel's Performance with Revenue Management Analytics,"AUGUST 4, 2023",1
https://rategaincom.wpenginepowered.com/wp-content/uploads/2023/08/How-Hotels-Can-Stay-Ahead-in-Dynamic-Hospitality-Industry.webp,How Hotels Can Stay Ahead in the Dynamic Hospitality Industry,"AUGUST 4, 2023",1
https://rategaincom.wpenginepowered.com/wp-content/uploads/2023/08/Hospitality-Management-Unraveled-Journey-of-Experiences.png,What is Hospitality Management? Why is it Important?,"AUGUST 1, 2023",0
https://rategaincom.wpenginepowered.com/wp-content/uploads/2023/08/Has-_The-Swiftie-Fever_-Opened-New-Travel-Avenues-In-the-U.S.webp,Has 'The Swiftie Fever' Opened New Travel Avenues In the U.S.,"AUGUST 1, 2023",0
https://rategaincom.wpenginepowered.com/wp-content/uploads/2023/07/Strategies-to-Succeed-with-Technological-Partnerships-in-Hospitality.webp,How to Make Technology Partnerships Successful for Hotels,"JULY 21, 2023",0
https://rategaincom.wpenginepowered.com/wp-content/uploads/2023/07/AI-Machine-Learning-Who-Will-Lead-the-Change.webp,AI and Machine Learning – Who Will Lead the Change and What Will it Look Like?,"JULY 20, 2023",0
https://rategaincom.wpenginepowered.com/wp-content/uploads/2023/07/Strategies-for-Big-Hotel-Chains-to-Stay-Ahead.webp,Large Hotel Chains Can Move Fast Too: 10 Ideas To Implement Today,"JULY 18, 2023",0
https://rategaincom.wpenginepowered.com/wp-content/uploads/2023/07/Mastering-the-Distribution-Game-for-Big-Hotel-Chains.png,The Basics of Distribution for Hotel Chains,"JULY 18, 2023",0
https://rategaincom.wpenginepowered.com/wp-content/uploads/2023/07/The-Game-Changing-Benefits-of-Metasearch-Marketing.webp,Supercharging Hotel Bookings: The Game-Changing Benefits of Metasearch Marketing,"JULY 18, 2023",0
https://rategaincom.wpenginepowered.com/wp-content/uploads/2023/07/Techology-Stack-Needed-by-OTAs.webp,The Tech-Stack Needed by OTAs to Scale Your BI Capabilities,"JULY 17, 2023",0
https://rategaincom.wpenginepowered.com/wp-content/uploads/2023/07/The-Future-of-rate-parity-in-hospitality.webp,The Future of Rate Parity in the Hospitality Industry,"JULY 17, 2023",0
https://rategaincom.wpenginepowered.com/wp-content/uploads/2023/07/HOW-PRICING-WILL-CHANGE-IN-the-AGE-OF-AI.webp,How Hotel Pricing is Going to Change in the Age of AI,"JULY 12, 2023",0
https://rategaincom.wpenginepowered.com/wp-content/uploads/2023/07/Leveraging-Instagram-Threads-for-the-Travel-and-Hospitality-Industry.webp,Leveraging Instagram Threads for the Travel and Hospitality Industry,"JULY 10, 2023",0
https://rategaincom.wpenginepowered.com/wp-content/uploads/2023/07/GA4.webp,Calling All Hoteliers: Unleash the Power of GA4 for Optimal Performance,"JULY 7, 2023",1
https://rategaincom.wpenginepowered.com/wp-content/uploads/2023/07/Sustainable-Hotels.webp,Green Gold: Sustainable Hotels Shaping Profitable and Responsible Hospitality,"JULY 3, 2023",1
https://rategaincom.wpenginepowered.com/wp-content/uploads/2023/07/Managing-Cancellations-to-Optimize-Revenue-_-Guest-Satisfaction.webp,Managing Hotel Cancellations: Strategies to Optimize Revenue and Guest Satisfaction,"JUNE 28, 2023",0
https://rategaincom.wpenginepowered.com/wp-content/uploads/2023/06/Hotel-Big-Data-Analytics.webp,Big Data: The Game Changer in Hospitality Industry,"JUNE 27, 2023",0
https://rategaincom.wpenginepowered.com/wp-content/uploads/2023/06/Unveiling-the-Hotel-Challenges-Navigating-Obstacles-in-Dynamic-Hospitality-Landscape.webp,Unveiling the Hotel Challenges: Navigating Obstacles in the Dynamic Hospitality Landscape,"JUNE 26, 2023",0
https://rategaincom.wpenginepowered.com/wp-content/uploads/2023/06/Distribution-Challenges-for-Hotels-in-Latin-America.webp,Distribution Challenges for Hotels in Latin America,"JUNE 23, 2023",0
https://rategaincom.wpenginepowered.com/wp-content/uploads/2023/06/Cracking-Distribution-Code-Navigating-Challenges-with-Technology-and-Strategy.webp,Navigating Hotel Distribution Challenges with Technology and Strategy,"JUNE 22, 2023",1
https://rategaincom.wpenginepowered.com/wp-content/uploads/2023/06/Digital-foundation-in-hotel-industry.webp,What Does Digital Foundation in Hospitality Look Like,"JUNE 20, 2023",0
https://rategaincom.wpenginepowered.com/wp-content/uploads/2023/06/Effective-Hotel-Pricing-Strategies-During-Low-Demand-Periods.webp,Effective Hotel Pricing Strategies To Maximize Revenue During Low Demand Periods,"JUNE 13, 2023",0
https://rategaincom.wpenginepowered.com/wp-content/uploads/2023/06/allyship.webp,The Power of Allyship: Building Bridges of Support and Inclusion,"JUNE 12, 2023",0
https://rategaincom.wpenginepowered.com/wp-content/uploads/2023/06/Unlocking-Success-Strategies-for-Hotel-Revenue-Management-Hotel.webp,Mastering Success: Hotel Revenue Management Strategies for Optimal Growth,"JUNE 11, 2023",1
https://rategaincom.wpenginepowered.com/wp-content/uploads/2023/06/Solving-the-Challenge-of-Overbooking-in-Hotels.webp,Solving the Challenge of Overbooking in Hotels: Strategies for Seamless Guest Experience,"JUNE 10, 2023",0
https://rategaincom.wpenginepowered.com/wp-content/uploads/2023/06/Revenue-Management-Managing-Hotel-Demand-During-Special-Events.webp,Navigating the Highs and Lows: Managing Hotel Demand During Special Events,"JUNE 9, 2023",0
https://rategaincom.wpenginepowered.com/wp-content/uploads/2023/06/Revenue-Management-The-Impact-of-Weather-on-Hotel-Demand.webp,The Impact of Weather on Hotel Demand: Leveraging Insights for Success,"JUNE 9, 2023",0
https://rategaincom.wpenginepowered.com/wp-content/uploads/2023/06/AI-Powered-Innovations-for-the-Hotel-Industry.jpg,Inside Google Marketing Live 2023: AI-Powered Innovations & What They Mean for the Hotel Industry,"JUNE 8, 2023",0
https://rategaincom.wpenginepowered.com/wp-content/uploads/2023/06/Unlock-the-Secrets-of-Hotel-Loyalty-Programs.webp,Hotel Loyalty Programs: Building Customer Loyalty and Maximizing Rewards,"JUNE 8, 2023",0
https://rategaincom.wpenginepowered.com/wp-content/uploads/2023/06/Revenue-Management-Impact-of-Seasonality-on-Revenue.webp,The Impact of Seasonality on Hotel Revenue: Understanding the Highs and Lows,"JUNE 8, 2023",0
https://rategaincom.wpenginepowered.com/wp-content/uploads/2016/12/Industry-Statistics-ADR.webp,Walking the Tight Rope: High Hotel ADR and Low Distribution Cost,"JUNE 7, 2023",0
https://rategaincom.wpenginepowered.com/wp-content/uploads/2023/06/Inventory-Management-The-Role-of-CRS-in-Efficient-Hotel-Inventory-Distribution.webp,The Role of Central Reservation Systems in Efficient Hotel Inventory Distribution,"JUNE 7, 2023",0
https://rategaincom.wpenginepowered.com/wp-content/uploads/2023/06/pride-month-history.webp,The History of Pride Month: Celebrating Love and Equality,"JUNE 5, 2023",0
https://rategaincom.wpenginepowered.com/wp-content/uploads/2023/06/Hotel-Technology-4-A-Comprehensive-Guide-to-Cloud-Computing-for-Hotels.webp,A Comprehensive Guide to Cloud Computing for Hotels: Transforming the Hospitality Industry,"JUNE 5, 2023",0
https://rategaincom.wpenginepowered.com/wp-content/uploads/2023/06/Distribution-Understanding-Hotel-Central-Reservation-System-Streamlining-Operations-a.webp,Unlock the Power of a Hotel Central Reservation System,"JUNE 1, 2023",0
https://rategaincom.wpenginepowered.com/wp-content/uploads/2017/09/Hotel-Technology-3-Leveraging-Data-and-Analytics-to-Distribute-Your-Hotel-Inventory-Effectively.webp,Data and Analytics Can Help You Distribute Your Hotel Inventory Effectively & Run Hotel Profitably,"MAY 26, 2023",0
https://rategaincom.wpenginepowered.com/wp-content/uploads/2023/05/Hotel-Technology-2-Data-Driven-Excellence-Maximizing-Performance-with-Hotel-Data-Analytics.webp,Data-Driven Excellence: Maximizing Performance with Hotel Data Analytics,"MAY 26, 2023",0
https://rategaincom.wpenginepowered.com/wp-content/uploads/2023/05/Driving-Higher-Hotel-Occupancy-Rates.webp,Driving Higher Hotel Occupancy Rates: Implementing Effective Strategies,"MAY 25, 2023",0
https://rategaincom.wpenginepowered.com/wp-content/uploads/2023/01/Hotel-Digital-Marketing-Boost-Your-Online-Presence-_-Drive-Bookings.webp,The Complete Guide to Hotel Digital Marketing: Boost Your Online Presence and Drive Bookings,"MAY 24, 2023",0
https://rategaincom.wpenginepowered.com/wp-content/uploads/2022/12/Distribution-What-is-a-Global-Distribution-System-GDS-How-does-it-Benefit-Your-Hotel.webp,What is a Global Distribution System (GDS)? How does it Benefit Your Hotel?,"MAY 23, 2023",1
https://rategaincom.wpenginepowered.com/wp-content/uploads/2023/05/Hotel-Technology-1-The-Power-of-Hotel-Technology.webp,Unleashing the Power of Hotel Technology: The Game Changer in Tech-Savvy Hospitality,"MAY 23, 2023",1
https://rategaincom.wpenginepowered.com/wp-content/uploads/2023/05/Revenue-Management-Unlocking-Profitability-with-Hotel-Revenue-Management.webp,Unlocking Profitability: An Introduction to Hotel Revenue Management,"MAY 23, 2023",0
https://rategaincom.wpenginepowered.com/wp-content/uploads/2023/05/Destination-Marketing-2-Why-Should-all-Destinations-have-a-DMO.webp,Why Should All Destinations Have a Destination Marketing Organization (DMO)?,"MAY 22, 2023",0
https://rategaincom.wpenginepowered.com/wp-content/uploads/2023/05/Destination-Marketing-1-What-are-DMOs.webp,"Destination Marketing Organization: Its Roles, Importance, and Benefits in the Hospitality Industry","MAY 22, 2023",0
https://rategaincom.wpenginepowered.com/wp-content/uploads/2023/04/Distribution-Difference-between-Hotel-PMS-Channel-Manager-OTAs-and-Booking-Engine.webp,"Difference Between a Hotel PMS, Channel Manager, OTAs, and Booking Engine","MAY 22, 2023",3
https://rategaincom.wpenginepowered.com/wp-content/uploads/2023/03/Hotel-Distribution-Channels-A-Complete-Guide.webp,The Complete Guide to Distribution Channels in the Hotel Industry,"MAY 21, 2023",0
https://rategaincom.wpenginepowered.com/wp-content/uploads/2023/03/Effective-Channel-Management-for-Hospitality-Businesses.webp,Unlocking New Revenue Streams: A Guide to Effective Channel Management for Hospitality Businesses,"MAY 21, 2023",0
https://rategaincom.wpenginepowered.com/wp-content/uploads/2023/05/Metasearch-Engines-A-Game-Changer-for-Online-Businesses.webp,Unveiling the Magic of Metasearch Engines: A Game Changer for Online Businesses,"MAY 21, 2023",0
https://rategaincom.wpenginepowered.com/wp-content/uploads/2023/05/Adapting-Hotel-Distribution-Mastering-Content-Management-for-Success.webp,Where does Content Fit in the Evolution of Hotel Distribution?,"MAY 20, 2023",0
https://rategaincom.wpenginepowered.com/wp-content/uploads/2023/05/Boost-your-Online-Presence-with-a-Hotel-Content-Management-System.webp,Boost Your Hotel's Online Presence with a Hotel Content Management System,"MAY 19, 2023",0
https://rategaincom.wpenginepowered.com/wp-content/uploads/2023/05/Streamlining-Hotel-Pricing-Strategy-with-Advanced-Rate-Shopping-Software.webp,Streamline Your Hotel Pricing Strategy with Advanced Rate Shopping Software,"MAY 18, 2023",0
https://rategaincom.wpenginepowered.com/wp-content/uploads/2016/10/Dynamic-Pricing-Strategy-for-the-Hospitality-Industry.webp,Dynamic Pricing Strategy in Hotels for Hospitality Industry,"MAY 18, 2023",5
https://rategaincom.wpenginepowered.com/wp-content/uploads/2023/05/Pricing-Strategy-1-Hotel-Pricing-Strategy-for-Revenue-Maximization.webp,Hotel Pricing Strategy: Maximizing Revenue Through Effective Pricing Techniques,"MAY 18, 2023",0
https://rategaincom.wpenginepowered.com/wp-content/uploads/2023/05/Google-Hotel-Ads-_1-How-to-use-Google-Hotel-Ads-A-Complete-Guide.webp,How To Use Google Hotel Ads: A Complete Guide,"MAY 18, 2023",0
https://rategaincom.wpenginepowered.com/wp-content/uploads/2023/05/Inventory-Management-4-Boost-your-Hotel-Revenue-with-Efficient-Hotel-Inventory-Management.webp,Boost Your Hotel Revenue with Efficient Hotel Inventory Management,"MAY 16, 2023",0
https://rategaincom.wpenginepowered.com/wp-content/uploads/2023/05/Inventory-Management-3-How-can-you-Benefit-from-Hotel-Wholesalers.webp,Cracking the Code: How to Benefit from Hotel Wholesalers,"MAY 16, 2023",0
https://rategaincom.wpenginepowered.com/wp-content/uploads/2023/05/Rate-Parity-_2-Important-Tips-to-cope-up-with-Rate-Parity-Issues.webp,8 Easy Tips for Hotel Revenue Managers to Cope With Rate Parity Issues,"MAY 15, 2023",1
https://rategaincom.wpenginepowered.com/wp-content/uploads/2023/05/Rate-Parity-_1-What-is-Hotel-Rate-Parity-Why-is-it-Important.webp,What is Hotel Rate Parity? Why is it Important in the Hotel Industry?,"MAY 15, 2023",0
https://rategaincom.wpenginepowered.com/wp-content/uploads/2016/03/Channel-Management-2-Critical-Factors-to-Consider-before-you-Invest-in-a-Hotel-Channel-Manager.webp,18 Factors to Consider before Investing in Channel Manager for Your Hotel,"MAY 14, 2023",0
https://rategaincom.wpenginepowered.com/wp-content/uploads/2023/05/Hotel-Sales-Strategy-Crucial-Hotel-Sales-Strategies-to-Boost-Occupancy-and-Revenue.webp,Crucial Hotel Sales Strategies to Boost Occupancy and Revenue,"MAY 14, 2023",0
https://rategaincom.wpenginepowered.com/wp-content/uploads/2023/05/Channel-Management-1-What-is-a-channel-manager.webp,What is a Hotel Channel Manager? How Do You Choose the Perfect One?,"MAY 14, 2023",0
https://rategaincom.wpenginepowered.com/wp-content/uploads/2023/05/Content-Management-5-How-Can-Content-Solve-The-Expectation-Gap-for-Hotels.webp,How Can Content Solve The Expectation Gap for Hotels?,"MAY 13, 2023",0
https://rategaincom.wpenginepowered.com/wp-content/uploads/2023/05/Changing-Markets-Post-Pandemic-Guest-Behaviors-Changing-Booking-Inspiration.png,Changing Markets Post-Pandemic: Guest Behaviors Changing Booking Inspiration,"MAY 11, 2023",0
https://rategaincom.wpenginepowered.com/wp-content/uploads/2023/05/Occupancy-Rate-and-calculation.webp,What is Hotel Occupancy Rate? How to Calculate it?,"MAY 6, 2023",2
https://rategaincom.wpenginepowered.com/wp-content/uploads/2023/05/Is-RevPAR-the-Best-Metric-to-Measure-Profitability-scaled.webp,Is RevPAR the Best Metric to Measure Profitability?,"MAY 5, 2023",0
https://rategaincom.wpenginepowered.com/wp-content/uploads/2023/05/Content-Management-4-Why-Should-Hotels-Update-Content-on-OTAs-Frequently.webp,Why Should Hotels Update Content On OTAs Frequently?,"MAY 5, 2023",2
https://rategaincom.wpenginepowered.com/wp-content/uploads/2023/05/Why-Metasearch-is-critical-for-your-hotels-Direct-Bookings-Strategy-scaled.webp,Why Metasearch is critical for your Direct Bookings Strategy,"MAY 4, 2023",0
https://rategaincom.wpenginepowered.com/wp-content/uploads/2023/05/Content-Management-3-Why-Content-on-OTAs-is-Critical-for-Improving-Conversion-Rates-scaled.webp,Why Content on OTAs is Critical for Improving Conversion Rates,"MAY 3, 2023",0
https://rategaincom.wpenginepowered.com/wp-content/uploads/2023/05/How-do-Hotels-Distribute-Inventory-to-Drive-Bookings-scaled.webp,How do Hotels Distribute Inventory to Drive Bookings,"MAY 3, 2023",0
https://rategaincom.wpenginepowered.com/wp-content/uploads/2023/05/What-is-RevPAR-scaled.webp,What is RevPAR ? Why does it Matter?,"MAY 1, 2023",0
https://rategaincom.wpenginepowered.com/wp-content/uploads/2023/01/A-Complete-Guide-to-Hotel-Marketing-Strategy-_1_.webp,A Complete Guide to Hotel Marketing Strategy for 2023,"APRIL 30, 2023",0
https://rategaincom.wpenginepowered.com/wp-content/uploads/2023/04/Latin-Americas-Hospitality-Industry-is-Ready-to-Take-the-AI-Leap-into-the-Future-1.jpg,Latin America’s Hospitality Industry is Ready to Take the AI Leap into the Future,"APRIL 27, 2023",0
https://rategaincom.wpenginepowered.com/wp-content/uploads/2023/06/Kamesh-Shukla-on-Sustainable-Travel.webp,Sustainability: The Conversation We Need To Have With ChatGPT Today,"APRIL 27, 2023",0
https://rategaincom.wpenginepowered.com/wp-content/uploads/2023/04/Content-Management-2-Why-Should-You-Care-About-Hotel-Content-Management-Distribution-scaled.webp,Here's Why You Should Care About Hotel Content Management & Distribution,"APRIL 22, 2023",4
https://rategaincom.wpenginepowered.com/wp-content/uploads/2023/04/Why-Ease-of-Use-is-the-Core-of-any-Booking-Engine.webp,Why Ease of Use is the Core of any Booking Engine?,"APRIL 15, 2023",4
https://rategaincom.wpenginepowered.com/wp-content/uploads/2023/05/Why-is-Security-Critical-for-a-Hotel-Booking-Engine-scaled.webp,Why is Security Critical for a Booking Engine?,"APRIL 14, 2023",4
https://rategaincom.wpenginepowered.com/wp-content/uploads/2023/04/boooking-com-blog-1.jpg,Thank You Booking.com For Showing Us The Future,"APRIL 13, 2023",0
https://rategaincom.wpenginepowered.com/wp-content/uploads/2023/05/How-do-you-Evaluate-a-Hotel-Booking-Engine-scaled.webp,How to Evaluate a Booking Engine?,"APRIL 13, 2023",3
https://rategaincom.wpenginepowered.com/wp-content/uploads/2023/05/All-You-Need-to-Know-About-a-Hotel-Booking-Engine-scaled.webp,All You Need to Know About a Hotel Booking Engine,"APRIL 12, 2023",0
https://rategaincom.wpenginepowered.com/wp-content/uploads/2023/04/MicrosoftTeams-image-8.jpg,Revolutionizing Guest Experiences and Revenue Management with AI,"APRIL 6, 2023",5
https://rategaincom.wpenginepowered.com/wp-content/uploads/2023/04/what-is-a-direct-booking.jpg,What is Direct Booking?,"APRIL 5, 2023",5
https://rategaincom.wpenginepowered.com/wp-content/uploads/2023/04/Content-Management-1-What-is-the-Relevance-of-Content-for-Hotels-scaled.webp,The Relevance of Content for Hotels,"APRIL 1, 2023",0
https://rategaincom.wpenginepowered.com/wp-content/uploads/2023/03/MicrosoftTeams-image-2-1.jpg,Leading the Way: Top 8 Hospitality Technology Trends to Watch in 2023,"MARCH 21, 2023",3
https://rategaincom.wpenginepowered.com/wp-content/uploads/2023/03/A-Complete-Guide-to-Hotel-Connectivity-_-Distribution.webp,A Complete Guide to Hotel Connectivity & Distribution,"MARCH 21, 2023",0
https://rategaincom.wpenginepowered.com/wp-content/uploads/2023/03/MicrosoftTeams-image-3-1.jpg,Revolutionizing the Hospitality Industry: The Role of Advanced Channel Managers in Driving Hotel Business Growth,"MARCH 16, 2023",0
https://rategaincom.wpenginepowered.com/wp-content/uploads/2023/05/What-are-the-Key-Hotel-Industry-Statistics-scaled.webp,What are Hotel Industry Statistics?,"MARCH 6, 2023",0
